text,cleaning,case_folding,tokenizing,normalisasi,label
"Akhirnya BTR menang aku sneng,kalo yang menang onic GK seneng aku karena kelra Ama kairi GK mau pakek jaket indo kek sombong banget gitu,Eman aja yng orang ph aja mau pakek, itulah onic runtuh karena kesombongan playernya😊",Akhirnya BTR menang aku snengkalo yang menang onic GK seneng aku karena kelra Ama kairi GK mau pakek jaket indo kek sombong banget gituEman aja yng orang ph aja mau pakek itulah onic runtuh karena kesombongan playernya,akhirnya btr menang aku snengkalo yang menang onic gk seneng aku karena kelra ama kairi gk mau pakek jaket indo kek sombong banget gitueman aja yng orang ph aja mau pakek itulah onic runtuh karena kesombongan playernya,"['akhirnya', 'btr', 'menang', 'aku', 'snengkalo', 'yang', 'menang', 'onic', 'gk', 'seneng', 'aku', 'karena', 'kelra', 'ama', 'kairi', 'gk', 'mau', 'pakek', 'jaket', 'indo', 'kek', 'sombong', 'banget', 'gitueman', 'aja', 'yng', 'orang', 'ph', 'aja', 'mau', 'pakek', 'itulah', 'onic', 'runtuh', 'karena', 'kesombongan', 'playernya']","['akhirnya', 'btr', 'menang', 'aku', 'snengkalo', 'yang', 'menang', 'onic', 'tidak', 'seneng', 'aku', 'karena', 'kelra', 'ama', 'kairi', 'tidak', 'mau', 'pakek', 'jaket', 'indo', 'kek', 'sombong', 'banget', 'gitueman', 'saja', 'yng', 'orang', 'ph', 'saja', 'mau', 'pakek', 'itulah', 'onic', 'runtuh', 'karena', 'kesombongan', 'playernya']",Toxic
GG koED full senyumm,GG koED full senyumm,gg koed full senyumm,"['gg', 'koed', 'full', 'senyumm']","['gg', 'koed', 'full', 'senyumm']",Non-Toxic
"Akhirnya ya sebagai fans btr full senyum divisi mlbb nya juara, congrats",Akhirnya ya sebagai fans btr full senyum divisi mlbb nya juara congrats,akhirnya ya sebagai fans btr full senyum divisi mlbb nya juara congrats,"['akhirnya', 'ya', 'sebagai', 'fans', 'btr', 'full', 'senyum', 'divisi', 'mlbb', 'nya', 'juara', 'congrats']","['akhirnya', 'ya', 'sebagai', 'fans', 'btr', 'full', 'senyum', 'divisi', 'mlbb', 'nya', 'juara', 'congrats']",Non-Toxic
see you in MSC guys,see you in MSC guys,see you in msc guys,"['see', 'you', 'in', 'msc', 'guys']","['see', 'you', 'in', 'msc', 'guys']",Non-Toxic
"Wah gua telat nonton, selamat yah buat juara baru bigetron by vitality 🎉🎉🎉🎉",Wah gua telat nonton selamat yah buat juara baru bigetron by vitality,wah gua telat nonton selamat yah buat juara baru bigetron by vitality,"['wah', 'gua', 'telat', 'nonton', 'selamat', 'yah', 'buat', 'juara', 'baru', 'bigetron', 'by', 'vitality']","['wah', 'gue', 'telat', 'nonton', 'selamat', 'yah', 'buat', 'juara', 'baru', 'bigetron', 'by', 'vitality']",Non-Toxic
GG SI ANALISI HERTOD BRU MASUK LNGSUNG JUARA CONGRATS HERTOD DAN BTR,GG SI ANALISI HERTOD BRU MASUK LNGSUNG JUARA CONGRATS HERTOD DAN BTR,gg si analisi hertod bru masuk lngsung juara congrats hertod dan btr,"['gg', 'si', 'analisi', 'hertod', 'bru', 'masuk', 'lngsung', 'juara', 'congrats', 'hertod', 'dan', 'btr']","['gg', 'si', 'analisi', 'hertod', 'bru', 'masuk', 'lngsung', 'juara', 'congrats', 'hertod', 'dan', 'btr']",Non-Toxic
Congratulation,Congratulation,congratulation,['congratulation'],['congratulation'],Non-Toxic
"kuat di regular = playoff lemah
lemah di playoff = playoff kuat",kuat di regular playoff lemah lemah di playoff playoff kuat,kuat di regular playoff lemah lemah di playoff playoff kuat,"['kuat', 'di', 'regular', 'playoff', 'lemah', 'lemah', 'di', 'playoff', 'playoff', 'kuat']","['kuat', 'di', 'regular', 'playoff', 'lemah', 'lemah', 'di', 'playoff', 'playoff', 'kuat']",Toxic
UDAH LAMA GAK NONTON DAN NGIKUTIN MPL. OMG NNAELLLLLL,UDAH LAMA GAK NONTON DAN NGIKUTIN MPL OMG NNAELLLLLL,udah lama gak nonton dan ngikutin mpl omg nnaellllll,"['udah', 'lama', 'gak', 'nonton', 'dan', 'ngikutin', 'mpl', 'omg', 'nnaellllll']","['udah', 'lama', 'tidak', 'nonton', 'dan', 'ngikutin', 'mpl', 'omg', 'nnaellllll']",Non-Toxic
Akhirnya ada yang bisa ngalahin onic,Akhirnya ada yang bisa ngalahin onic,akhirnya ada yang bisa ngalahin onic,"['akhirnya', 'ada', 'yang', 'bisa', 'ngalahin', 'onic']","['akhirnya', 'ada', 'yang', 'bisa', 'ngalahin', 'onic']",Non-Toxic
"Makasih btr sudah menang season ini,biar onic terhina karena menganggap ini liga tani",Makasih btr sudah menang season inibiar onic terhina karena menganggap ini liga tani,makasih btr sudah menang season inibiar onic terhina karena menganggap ini liga tani,"['makasih', 'btr', 'sudah', 'menang', 'season', 'inibiar', 'onic', 'terhina', 'karena', 'menganggap', 'ini', 'liga', 'tani']","['terima kasih', 'btr', 'sudah', 'menang', 'season', 'inibiar', 'onic', 'terhina', 'karena', 'menganggap', 'ini', 'liga', 'tani']",Non-Toxic
Mengukir sejarah btr  jago mpl juara 1 mdl juara satu  mantap  bau cuan cair kerja keras membuahkan hasil i like btr  👍👍👍👍👍👍👍,Mengukir sejarah btr jago mpl juara mdl juara satu mantap bau cuan cair kerja keras membuahkan hasil i like btr,mengukir sejarah btr jago mpl juara mdl juara satu mantap bau cuan cair kerja keras membuahkan hasil i like btr,"['mengukir', 'sejarah', 'btr', 'jago', 'mpl', 'juara', 'mdl', 'juara', 'satu', 'mantap', 'bau', 'cuan', 'cair', 'kerja', 'keras', 'membuahkan', 'hasil', 'i', 'like', 'btr']","['mengukir', 'sejarah', 'btr', 'jago', 'mpl', 'juara', 'mdl', 'juara', 'satu', 'mantap', 'bau', 'cuan', 'cair', 'kerja', 'keras', 'membuahkan', 'hasil', 'i', 'like', 'btr']",Non-Toxic
"Ga nyangka gw sama BTR, congrats buat BTR NT buat onic",Ga nyangka gw sama BTR congrats buat BTR NT buat onic,ga nyangka gw sama btr congrats buat btr nt buat onic,"['ga', 'nyangka', 'gw', 'sama', 'btr', 'congrats', 'buat', 'btr', 'nt', 'buat', 'onic']","['tidak', 'nyangka', 'gue', 'sama', 'btr', 'congrats', 'buat', 'btr', 'nt', 'buat', 'onic']",Non-Toxic
Hertod dengan analisinya 😂,Hertod dengan analisinya,hertod dengan analisinya,"['hertod', 'dengan', 'analisinya']","['hertod', 'dengan', 'analisinya']",Non-Toxic
Alhamdulillah tim kebanggaan gw juaraa🔥🔥🔥🥲,Alhamdulillah tim kebanggaan gw juaraa,alhamdulillah tim kebanggaan gw juaraa,"['alhamdulillah', 'tim', 'kebanggaan', 'gw', 'juaraa']","['alhamdulillah', 'tim', 'kebanggaan', 'gue', 'juaraa']",Non-Toxic
NT kelra ga bisa bawa pulang piala mpl id untuk ayahmu yang sudah berada di atas😢😢😢😢,NT kelra ga bisa bawa pulang piala mpl id untuk ayahmu yang sudah berada di atas,nt kelra ga bisa bawa pulang piala mpl id untuk ayahmu yang sudah berada di atas,"['nt', 'kelra', 'ga', 'bisa', 'bawa', 'pulang', 'piala', 'mpl', 'id', 'untuk', 'ayahmu', 'yang', 'sudah', 'berada', 'di', 'atas']","['nt', 'kelra', 'tidak', 'bisa', 'bawa', 'pulang', 'piala', 'mpl', 'id', 'untuk', 'ayahmu', 'yang', 'sudah', 'berada', 'di', 'atas']",Non-Toxic
bang ler bang ler tolongin bang ler😂,bang ler bang ler tolongin bang ler,bang ler bang ler tolongin bang ler,"['bang', 'ler', 'bang', 'ler', 'tolongin', 'bang', 'ler']","['bang', 'ler', 'bang', 'ler', 'tolongin', 'bang', 'ler']",Non-Toxic
"begatron by vitalty menang 🤩🎉
onic kalah 😢😭

semoga bisa lebih jago lagi onic jangan nyerah 😁

gw supporter nya onic 💖",begatron by vitalty menang onic kalah semoga bisa lebih jago lagi onic jangan nyerah gw supporter nya onic,begatron by vitalty menang onic kalah semoga bisa lebih jago lagi onic jangan nyerah gw supporter nya onic,"['begatron', 'by', 'vitalty', 'menang', 'onic', 'kalah', 'semoga', 'bisa', 'lebih', 'jago', 'lagi', 'onic', 'jangan', 'nyerah', 'gw', 'supporter', 'nya', 'onic']","['begatron', 'by', 'vitalty', 'menang', 'onic', 'kalah', 'semoga', 'bisa', 'lebih', 'jago', 'lagi', 'onic', 'jangan', 'nyerah', 'gue', 'supporter', 'nya', 'onic']",Non-Toxic
Akhirnya ada juara baru 🔥🔥🔥,Akhirnya ada juara baru,akhirnya ada juara baru,"['akhirnya', 'ada', 'juara', 'baru']","['akhirnya', 'ada', 'juara', 'baru']",Non-Toxic
BTR menyelamatkan dunia daripada kebisingan,BTR menyelamatkan dunia daripada kebisingan,btr menyelamatkan dunia daripada kebisingan,"['btr', 'menyelamatkan', 'dunia', 'daripada', 'kebisingan']","['btr', 'menyelamatkan', 'dunia', 'daripada', 'kebisingan']",Non-Toxic
giliran kita dukung 2 tim ini di paris ❤ 💛,giliran kita dukung tim ini di paris,giliran kita dukung tim ini di paris,"['giliran', 'kita', 'dukung', 'tim', 'ini', 'di', 'paris']","['giliran', 'kita', 'dukung', 'tim', 'ini', 'di', 'paris']",Non-Toxic
"Congrats BTR, gua Sonic bangga sama BTR",Congrats BTR gua Sonic bangga sama BTR,congrats btr gua sonic bangga sama btr,"['congrats', 'btr', 'gua', 'sonic', 'bangga', 'sama', 'btr']","['congrats', 'btr', 'gue', 'sonic', 'bangga', 'sama', 'btr']",Non-Toxic
CONGRATULATIONS BTR JUARA MPL ID S17,CONGRATULATIONS BTR JUARA MPL ID S,congratulations btr juara mpl id s,"['congratulations', 'btr', 'juara', 'mpl', 'id', 's']","['congratulations', 'btr', 'juara', 'mpl', 'id', 's']",Non-Toxic
Lah bukannya kebalik tuh yg bising yg sebelah? gw aja Sonic seneng liat btr juara😹😹,Lah bukannya kebalik tuh yg bising yg sebelah gw aja Sonic seneng liat btr juara,lah bukannya kebalik tuh yg bising yg sebelah gw aja sonic seneng liat btr juara,"['lah', 'bukannya', 'kebalik', 'tuh', 'yg', 'bising', 'yg', 'sebelah', 'gw', 'aja', 'sonic', 'seneng', 'liat', 'btr', 'juara']","['lah', 'bukannya', 'kebalik', 'tuh', 'yang', 'bising', 'yang', 'sebelah', 'gue', 'saja', 'sonic', 'seneng', 'liat', 'btr', 'juara']",Non-Toxic
"Gak mau bising diam dah
(Dari Vans netral)",Gak mau bising diam dah Dari Vans netral,gak mau bising diam dah dari vans netral,"['gak', 'mau', 'bising', 'diam', 'dah', 'dari', 'vans', 'netral']","['tidak', 'mau', 'bising', 'diam', 'sudah', 'dari', 'vans', 'netral']",Non-Toxic
Justru tim elu yg bising Onic selamat Mpl adem aja Sampai ada rrq yg membuka segel Onic,Justru tim elu yg bising Onic selamat Mpl adem aja Sampai ada rrq yg membuka segel Onic,justru tim elu yg bising onic selamat mpl adem aja sampai ada rrq yg membuka segel onic,"['justru', 'tim', 'elu', 'yg', 'bising', 'onic', 'selamat', 'mpl', 'adem', 'aja', 'sampai', 'ada', 'rrq', 'yg', 'membuka', 'segel', 'onic']","['justru', 'tim', 'elu', 'yang', 'bising', 'onic', 'selamat', 'mpl', 'adem', 'saja', 'sampai', 'ada', 'rrq', 'yang', 'membuka', 'segel', 'onic']",Non-Toxic
​ @khansamaulana-w6d husst diam aja bang palingan tim sebelah yg belum buka puasa dari s9 wkwkwk🗿🗿,wd husst diam aja bang palingan tim sebelah yg belum buka puasa dari s wkwkwk,wd husst diam aja bang palingan tim sebelah yg belum buka puasa dari s wkwkwk,"['wd', 'husst', 'diam', 'aja', 'bang', 'palingan', 'tim', 'sebelah', 'yg', 'belum', 'buka', 'puasa', 'dari', 's', 'wkwkwk']","['wd', 'husst', 'diam', 'saja', 'bang', 'palingan', 'tim', 'sebelah', 'yang', 'belum', 'buka', 'puasa', 'dari', 's', 'wkwkwk']",Non-Toxic
"Yuk season depan
Dewa
NAVI
AE
GEEK

Bisa yuk",Yuk season depan Dewa NAVI AE GEEK Bisa yuk,yuk season depan dewa navi ae geek bisa yuk,"['yuk', 'season', 'depan', 'dewa', 'navi', 'ae', 'geek', 'bisa', 'yuk']","['yuk', 'season', 'depan', 'dewa', 'navi', 'ae', 'geek', 'bisa', 'yuk']",Non-Toxic
"Rispek buat koh Ed walaupun dia yang paling menanti-nanti kan Piala tersebut berseason season
Tapi dia tetap mengalah agar euforia juara  para Player yang tersorot
Rispek dari Sonic 👌👌",Rispek buat koh Ed walaupun dia yang paling menantinanti kan Piala tersebut berseason season Tapi dia tetap mengalah agar euforia juara para Player yang tersorot Rispek dari Sonic,rispek buat koh ed walaupun dia yang paling menantinanti kan piala tersebut berseason season tapi dia tetap mengalah agar euforia juara para player yang tersorot rispek dari sonic,"['rispek', 'buat', 'koh', 'ed', 'walaupun', 'dia', 'yang', 'paling', 'menantinanti', 'kan', 'piala', 'tersebut', 'berseason', 'season', 'tapi', 'dia', 'tetap', 'mengalah', 'agar', 'euforia', 'juara', 'para', 'player', 'yang', 'tersorot', 'rispek', 'dari', 'sonic']","['rispek', 'buat', 'koh', 'ed', 'walaupun', 'dia', 'yang', 'paling', 'menantinanti', 'kan', 'piala', 'tersebut', 'berseason', 'season', 'tapi', 'dia', 'tetap', 'mengalah', 'agar', 'euforia', 'juara', 'para', 'player', 'yang', 'tersorot', 'rispek', 'dari', 'sonic']",Non-Toxic
"Pdhal dulu lemon ngmong btr cuma kelinci prcobaan rrq😂, skrng mlh juara 😂😂",Pdhal dulu lemon ngmong btr cuma kelinci prcobaan rrq skrng mlh juara,pdhal dulu lemon ngmong btr cuma kelinci prcobaan rrq skrng mlh juara,"['pdhal', 'dulu', 'lemon', 'ngmong', 'btr', 'cuma', 'kelinci', 'prcobaan', 'rrq', 'skrng', 'mlh', 'juara']","['pdhal', 'dulu', 'lemon', 'ngmong', 'btr', 'cuma', 'kelinci', 'prcobaan', 'rrq', 'skrng', 'mlh', 'juara']",Non-Toxic
PAK AP..MPL UDAAH SELESAI..AYOK PAK AP..BOORONG SEMUA PLAYER BTR PAK AP....😂😂😂😂😂,PAK APMPL UDAAH SELESAIAYOK PAK APBOORONG SEMUA PLAYER BTR PAK AP,pak apmpl udaah selesaiayok pak apboorong semua player btr pak ap,"['pak', 'apmpl', 'udaah', 'selesaiayok', 'pak', 'apboorong', 'semua', 'player', 'btr', 'pak', 'ap']","['pak', 'apmpl', 'udaah', 'selesaiayok', 'pak', 'apboorong', 'semua', 'player', 'btr', 'pak', 'ap']",Non-Toxic
"Buat BTR siapin. Tiket ke Paris buat sipancoro ya, tu jimat ga kaleng kaleng",Buat BTR siapin Tiket ke Paris buat sipancoro ya tu jimat ga kaleng kaleng,buat btr siapin tiket ke paris buat sipancoro ya tu jimat ga kaleng kaleng,"['buat', 'btr', 'siapin', 'tiket', 'ke', 'paris', 'buat', 'sipancoro', 'ya', 'tu', 'jimat', 'ga', 'kaleng', 'kaleng']","['buat', 'btr', 'siapin', 'tiket', 'ke', 'paris', 'buat', 'sipancoro', 'ya', 'tu', 'jimat', 'tidak', 'kaleng', 'kaleng']",Non-Toxic
"Hertod effect jir, congrats btr👏👏",Hertod effect jir congrats btr,hertod effect jir congrats btr,"['hertod', 'effect', 'jir', 'congrats', 'btr']","['hertod', 'effect', 'jir', 'congrats', 'btr']",Non-Toxic
selamat buat btr dan nt buat onic salam dari kingdom🎉🎉,selamat buat btr dan nt buat onic salam dari kingdom,selamat buat btr dan nt buat onic salam dari kingdom,"['selamat', 'buat', 'btr', 'dan', 'nt', 'buat', 'onic', 'salam', 'dari', 'kingdom']","['selamat', 'buat', 'btr', 'dan', 'nt', 'buat', 'onic', 'salam', 'dari', 'kingdom']",Non-Toxic
"UDAH SELESAI MPL WOI, HERTOD UPLOAD LAH, UDAH JUARA KAN, BOSEN BANGET GW JIRRRRR",UDAH SELESAI MPL WOI HERTOD UPLOAD LAH UDAH JUARA KAN BOSEN BANGET GW JIRRRRR,udah selesai mpl woi hertod upload lah udah juara kan bosen banget gw jirrrrr,"['udah', 'selesai', 'mpl', 'woi', 'hertod', 'upload', 'lah', 'udah', 'juara', 'kan', 'bosen', 'banget', 'gw', 'jirrrrr']","['udah', 'selesai', 'mpl', 'woi', 'hertod', 'upload', 'lah', 'udah', 'juara', 'kan', 'bosen', 'banget', 'gue', 'jirrrrr']",Non-Toxic
"Kolom komentar semalam isinya rame hujat Onic dan kemungkinan besar itu manusia2 yang sama dengan yg spam Btr badut playoff kmaren2. Tolong untuk Admin MPL kalau ada komen2 cuma nge hate kaya gitu di banned aja, itu cuma SDM2 rendah yg ga ada kerjaan, kemungkinan lagi stres sama IRLnya dan jelas2 mereka bukan fans dari kedua tim.

Anyway, GG Btr GG Onic, ayo bawa pulang Piala MSC ❤👍",Kolom komentar semalam isinya rame hujat Onic dan kemungkinan besar itu manusia yang sama dengan yg spam Btr badut playoff kmaren Tolong untuk Admin MPL kalau ada komen cuma nge hate kaya gitu di banned aja itu cuma SDM rendah yg ga ada kerjaan kemungkinan lagi stres sama IRLnya dan jelas mereka bukan fans dari kedua tim Anyway GG Btr GG Onic ayo bawa pulang Piala MSC,kolom komentar semalam isinya rame hujat onic dan kemungkinan besar itu manusia yang sama dengan yg spam btr badut playoff kmaren tolong untuk admin mpl kalau ada komen cuma nge hate kaya gitu di banned aja itu cuma sdm rendah yg ga ada kerjaan kemungkinan lagi stres sama irlnya dan jelas mereka bukan fans dari kedua tim anyway gg btr gg onic ayo bawa pulang piala msc,"['kolom', 'komentar', 'semalam', 'isinya', 'rame', 'hujat', 'onic', 'dan', 'kemungkinan', 'besar', 'itu', 'manusia', 'yang', 'sama', 'dengan', 'yg', 'spam', 'btr', 'badut', 'playoff', 'kmaren', 'tolong', 'untuk', 'admin', 'mpl', 'kalau', 'ada', 'komen', 'cuma', 'nge', 'hate', 'kaya', 'gitu', 'di', 'banned', 'aja', 'itu', 'cuma', 'sdm', 'rendah', 'yg', 'ga', 'ada', 'kerjaan', 'kemungkinan', 'lagi', 'stres', 'sama', 'irlnya', 'dan', 'jelas', 'mereka', 'bukan', 'fans', 'dari', 'kedua', 'tim', 'anyway', 'gg', 'btr', 'gg', 'onic', 'ayo', 'bawa', 'pulang', 'piala', 'msc']","['kolom', 'komentar', 'semalam', 'isinya', 'rame', 'hujat', 'onic', 'dan', 'kemungkinan', 'besar', 'itu', 'manusia', 'yang', 'sama', 'dengan', 'yang', 'spam', 'btr', 'badut', 'playoff', 'kmaren', 'tolong', 'untuk', 'admin', 'mpl', 'kalau', 'ada', 'komen', 'cuma', 'nge', 'hate', 'kaya', 'gitu', 'di', 'banned', 'saja', 'itu', 'cuma', 'sdm', 'rendah', 'yang', 'tidak', 'ada', 'kerjaan', 'kemungkinan', 'lagi', 'stres', 'sama', 'irlnya', 'dan', 'jelas', 'mereka', 'bukan', 'fans', 'dari', 'kedua', 'tim', 'anyway', 'gg', 'btr', 'gg', 'onic', 'ayo', 'bawa', 'pulang', 'piala', 'msc']",Toxic
Ppq harus belajar dari BTR sihh 😂😂😂😂😂😂😂😂😂😂 iya gk,Ppq harus belajar dari BTR sihh iya gk,ppq harus belajar dari btr sihh iya gk,"['ppq', 'harus', 'belajar', 'dari', 'btr', 'sihh', 'iya', 'gk']","['ppq', 'harus', 'belajar', 'dari', 'btr', 'sihh', 'iya', 'tidak']",Non-Toxic
"Ga ada super""an di BTR,,akhir nya juara juga
Congrats BTR🥳",Ga ada superan di BTRakhir nya juara juga Congrats BTR,ga ada superan di btrakhir nya juara juga congrats btr,"['ga', 'ada', 'superan', 'di', 'btrakhir', 'nya', 'juara', 'juga', 'congrats', 'btr']","['tidak', 'ada', 'superan', 'di', 'btrakhir', 'nya', 'juara', 'juga', 'congrats', 'btr']",Non-Toxic
"Merinding btr juara, tim lama yg belum pernah juara akhirnya juara juga",Merinding btr juara tim lama yg belum pernah juara akhirnya juara juga,merinding btr juara tim lama yg belum pernah juara akhirnya juara juga,"['merinding', 'btr', 'juara', 'tim', 'lama', 'yg', 'belum', 'pernah', 'juara', 'akhirnya', 'juara', 'juga']","['merinding', 'btr', 'juara', 'tim', 'lama', 'yang', 'belum', 'pernah', 'juara', 'akhirnya', 'juara', 'juga']",Non-Toxic
The gold standard 😅makin parah cok,The gold standard makin parah cok,the gold standard makin parah cok,"['the', 'gold', 'standard', 'makin', 'parah', 'cok']","['the', 'gold', 'standard', 'makin', 'parah', 'cok']",Toxic
KUKIRA MAU MEMASAK EH MALAH DIMASAK🗿,KUKIRA MAU MEMASAK EH MALAH DIMASAK,kukira mau memasak eh malah dimasak,"['kukira', 'mau', 'memasak', 'eh', 'malah', 'dimasak']","['kukira', 'mau', 'memasak', 'eh', 'malah', 'dimasak']",Non-Toxic
"akhirnya ga si emaaannn, lu udah main di indo berapa season njir dan pada akhirnya setelah penantian lama lu di indo juara juga😭",akhirnya ga si emaaannn lu udah main di indo berapa season njir dan pada akhirnya setelah penantian lama lu di indo juara juga,akhirnya ga si emaaannn lu udah main di indo berapa season njir dan pada akhirnya setelah penantian lama lu di indo juara juga,"['akhirnya', 'ga', 'si', 'emaaannn', 'lu', 'udah', 'main', 'di', 'indo', 'berapa', 'season', 'njir', 'dan', 'pada', 'akhirnya', 'setelah', 'penantian', 'lama', 'lu', 'di', 'indo', 'juara', 'juga']","['akhirnya', 'tidak', 'si', 'emaaannn', 'lu', 'udah', 'main', 'di', 'indo', 'berapa', 'season', 'njir', 'dan', 'pada', 'akhirnya', 'setelah', 'penantian', 'lama', 'lu', 'di', 'indo', 'juara', 'juga']",Non-Toxic
Ga nyangka gw sumpah gg BTR,Ga nyangka gw sumpah gg BTR,ga nyangka gw sumpah gg btr,"['ga', 'nyangka', 'gw', 'sumpah', 'gg', 'btr']","['tidak', 'nyangka', 'gue', 'sumpah', 'gg', 'btr']",Non-Toxic
Ini kek bukan onic pada umumnya pas main. Ko bisa ya ?? Tp diluar dari itu happy liat btr ❤❤❤,Ini kek bukan onic pada umumnya pas main Ko bisa ya Tp diluar dari itu happy liat btr,ini kek bukan onic pada umumnya pas main ko bisa ya tp diluar dari itu happy liat btr,"['ini', 'kek', 'bukan', 'onic', 'pada', 'umumnya', 'pas', 'main', 'ko', 'bisa', 'ya', 'tp', 'diluar', 'dari', 'itu', 'happy', 'liat', 'btr']","['ini', 'kek', 'bukan', 'onic', 'pada', 'umumnya', 'pas', 'main', 'ko', 'bisa', 'ya', 'tapi', 'diluar', 'dari', 'itu', 'happy', 'liat', 'btr']",Non-Toxic
"GELOOO DARI YG AWAL UNDER HAMPIR GA MASUK PLAYOFF TERNYATA MALAH ANGKAT PIALA GELOO GELO,,,,, SI OREN MANA BISA KEK GINI UPSSSSS SORRY IZINNNNN",GELOOO DARI YG AWAL UNDER HAMPIR GA MASUK PLAYOFF TERNYATA MALAH ANGKAT PIALA GELOO GELO SI OREN MANA BISA KEK GINI UPSSSSS SORRY IZINNNNN,gelooo dari yg awal under hampir ga masuk playoff ternyata malah angkat piala geloo gelo si oren mana bisa kek gini upsssss sorry izinnnnn,"['gelooo', 'dari', 'yg', 'awal', 'under', 'hampir', 'ga', 'masuk', 'playoff', 'ternyata', 'malah', 'angkat', 'piala', 'geloo', 'gelo', 'si', 'oren', 'mana', 'bisa', 'kek', 'gini', 'upsssss', 'sorry', 'izinnnnn']","['gelooo', 'dari', 'yang', 'awal', 'under', 'hampir', 'tidak', 'masuk', 'playoff', 'ternyata', 'malah', 'angkat', 'piala', 'geloo', 'gelo', 'si', 'oren', 'mana', 'bisa', 'kek', 'gini', 'upsssss', 'sorry', 'izinnnnn']",Non-Toxic
"Mengapa ya ketika nonton mpl indo selalu bikin gregetan. 
Mungkin karena Sudan nonton MPL PH sehingga keliatan bgt bedanya. MPL indo sangat sering tidak mainin objektifnya baik dalam kondisi tertekan atau di tekan, trus jika war tidak tau targeting padahal musuh utamakan cuma 3 (mid, God & jungler), terus males bgt recal dan menganggap enteng HP yang sudah low padahal turun satu bar aj itu bisa pengaruh bgt sehingga gampang bgt ke pick of.
Saya rasa jika cara berpikirnya masih seperti seperti ini aj, ya indo gak akan bisa juara di EWC",Mengapa ya ketika nonton mpl indo selalu bikin gregetan Mungkin karena Sudan nonton MPL PH sehingga keliatan bgt bedanya MPL indo sangat sering tidak mainin objektifnya baik dalam kondisi tertekan atau di tekan trus jika war tidak tau targeting padahal musuh utamakan cuma mid God jungler terus males bgt recal dan menganggap enteng HP yang sudah low padahal turun satu bar aj itu bisa pengaruh bgt sehingga gampang bgt ke pick of Saya rasa jika cara berpikirnya masih seperti seperti ini aj ya indo gak akan bisa juara di EWC,mengapa ya ketika nonton mpl indo selalu bikin gregetan mungkin karena sudan nonton mpl ph sehingga keliatan bgt bedanya mpl indo sangat sering tidak mainin objektifnya baik dalam kondisi tertekan atau di tekan trus jika war tidak tau targeting padahal musuh utamakan cuma mid god jungler terus males bgt recal dan menganggap enteng hp yang sudah low padahal turun satu bar aj itu bisa pengaruh bgt sehingga gampang bgt ke pick of saya rasa jika cara berpikirnya masih seperti seperti ini aj ya indo gak akan bisa juara di ewc,"['mengapa', 'ya', 'ketika', 'nonton', 'mpl', 'indo', 'selalu', 'bikin', 'gregetan', 'mungkin', 'karena', 'sudan', 'nonton', 'mpl', 'ph', 'sehingga', 'keliatan', 'bgt', 'bedanya', 'mpl', 'indo', 'sangat', 'sering', 'tidak', 'mainin', 'objektifnya', 'baik', 'dalam', 'kondisi', 'tertekan', 'atau', 'di', 'tekan', 'trus', 'jika', 'war', 'tidak', 'tau', 'targeting', 'padahal', 'musuh', 'utamakan', 'cuma', 'mid', 'god', 'jungler', 'terus', 'males', 'bgt', 'recal', 'dan', 'menganggap', 'enteng', 'hp', 'yang', 'sudah', 'low', 'padahal', 'turun', 'satu', 'bar', 'aj', 'itu', 'bisa', 'pengaruh', 'bgt', 'sehingga', 'gampang', 'bgt', 'ke', 'pick', 'of', 'saya', 'rasa', 'jika', 'cara', 'berpikirnya', 'masih', 'seperti', 'seperti', 'ini', 'aj', 'ya', 'indo', 'gak', 'akan', 'bisa', 'juara', 'di', 'ewc']","['mengapa', 'ya', 'ketika', 'nonton', 'mpl', 'indo', 'selalu', 'bikin', 'gregetan', 'mungkin', 'karena', 'sudan', 'nonton', 'mpl', 'ph', 'sehingga', 'keliatan', 'banget', 'bedanya', 'mpl', 'indo', 'sangat', 'sering', 'tidak', 'mainin', 'objektifnya', 'baik', 'dalam', 'kondisi', 'tertekan', 'atau', 'di', 'tekan', 'trus', 'jika', 'war', 'tidak', 'tau', 'targeting', 'padahal', 'musuh', 'utamakan', 'cuma', 'mid', 'god', 'jungler', 'terus', 'males', 'banget', 'recal', 'dan', 'menganggap', 'enteng', 'hp', 'yang', 'sudah', 'low', 'padahal', 'turun', 'satu', 'bar', 'saja', 'itu', 'bisa', 'pengaruh', 'banget', 'sehingga', 'gampang', 'banget', 'ke', 'pick', 'of', 'saya', 'rasa', 'jika', 'cara', 'berpikirnya', 'masih', 'seperti', 'seperti', 'ini', 'saja', 'ya', 'indo', 'tidak', 'akan', 'bisa', 'juara', 'di', 'ewc']",Non-Toxic
"gg btr, nt onic id! goodluck for ewc 2026 guys! ❤️💛",gg btr nt onic id goodluck for ewc guys,gg btr nt onic id goodluck for ewc guys,"['gg', 'btr', 'nt', 'onic', 'id', 'goodluck', 'for', 'ewc', 'guys']","['gg', 'btr', 'nt', 'onic', 'id', 'goodluck', 'for', 'ewc', 'guys']",Non-Toxic
"Dih, muji mah muji aja tapi jangan nginjek pihak lain dulu. Malu ih, penyakit hatinya kelihatan. Iziiin",Dih muji mah muji aja tapi jangan nginjek pihak lain dulu Malu ih penyakit hatinya kelihatan Iziiin,dih muji mah muji aja tapi jangan nginjek pihak lain dulu malu ih penyakit hatinya kelihatan iziiin,"['dih', 'muji', 'mah', 'muji', 'aja', 'tapi', 'jangan', 'nginjek', 'pihak', 'lain', 'dulu', 'malu', 'ih', 'penyakit', 'hatinya', 'kelihatan', 'iziiin']","['dih', 'muji', 'mah', 'muji', 'saja', 'tapi', 'jangan', 'nginjek', 'pihak', 'lain', 'dulu', 'malu', 'ih', 'penyakit', 'hatinya', 'kelihatan', 'iziiin']",Non-Toxic
Tutor ngalahin BTR sama RRQ ya gaes,Tutor ngalahin BTR sama RRQ ya gaes,tutor ngalahin btr sama rrq ya gaes,"['tutor', 'ngalahin', 'btr', 'sama', 'rrq', 'ya', 'gaes']","['tutor', 'ngalahin', 'btr', 'sama', 'rrq', 'ya', 'gaes']",Non-Toxic
teori derwaman ke team yang di bawah is real,teori derwaman ke team yang di bawah is real,teori derwaman ke team yang di bawah is real,"['teori', 'derwaman', 'ke', 'team', 'yang', 'di', 'bawah', 'is', 'real']","['teori', 'derwaman', 'ke', 'team', 'yang', 'di', 'bawah', 'is', 'real']",Non-Toxic
"kalah tapi ketawa ketawa, menarikk hmmmm😂",kalah tapi ketawa ketawa menarikk hmmmm,kalah tapi ketawa ketawa menarikk hmmmm,"['kalah', 'tapi', 'ketawa', 'ketawa', 'menarikk', 'hmmmm']","['kalah', 'tapi', 'ketawa', 'ketawa', 'menarikk', 'hmmmm']",Non-Toxic
