text,cleaning,case_folding,tokenizing,normalisasi,label
"Kalo sekelas di mpl lagi udah kebaca, apa kemungkinan di Inter jg udah kebaca ama tim ph ama mungkin srg?",Kalo sekelas di mpl lagi udah kebaca apa kemungkinan di Inter jg udah kebaca ama tim ph ama mungkin srg,kalo sekelas di mpl lagi udah kebaca apa kemungkinan di inter jg udah kebaca ama tim ph ama mungkin srg,"['kalo', 'sekelas', 'di', 'mpl', 'lagi', 'udah', 'kebaca', 'apa', 'kemungkinan', 'di', 'inter', 'jg', 'udah', 'kebaca', 'ama', 'tim', 'ph', 'ama', 'mungkin', 'srg']","['kalau', 'sekelas', 'di', 'mpl', 'lagi', 'udah', 'kebaca', 'apa', 'kemungkinan', 'di', 'inter', 'juga', 'udah', 'kebaca', 'ama', 'tim', 'ph', 'ama', 'mungkin', 'srg']",Non-Toxic
Sama bg😭,Sama bg,sama bg,"['sama', 'bg']","['sama', 'bg']",Non-Toxic
Game gini doank segala kagak bisa tidur,Game gini doank segala kagak bisa tidur,game gini doank segala kagak bisa tidur,"['game', 'gini', 'doank', 'segala', 'kagak', 'bisa', 'tidur']","['game', 'gini', 'doank', 'segala', 'kagak', 'bisa', 'tidur']",Non-Toxic
Tidur lah besok mau ngecor😂,Tidur lah besok mau ngecor,tidur lah besok mau ngecor,"['tidur', 'lah', 'besok', 'mau', 'ngecor']","['tidur', 'lah', 'besok', 'mau', 'ngecor']",Non-Toxic
"kalo lu gabisa tidur gimana rasanya jadi fans yg ga lolos playoff, bersukur runner up🤣",kalo lu gabisa tidur gimana rasanya jadi fans yg ga lolos playoff bersukur runner up,kalo lu gabisa tidur gimana rasanya jadi fans yg ga lolos playoff bersukur runner up,"['kalo', 'lu', 'gabisa', 'tidur', 'gimana', 'rasanya', 'jadi', 'fans', 'yg', 'ga', 'lolos', 'playoff', 'bersukur', 'runner', 'up']","['kalau', 'lu', 'gabisa', 'tidur', 'gimana', 'rasanya', 'jadi', 'fans', 'yang', 'tidak', 'lolos', 'playoff', 'bersukur', 'runner', 'up']",Non-Toxic
Terharu melihat btr juara mpl mana mdl nya sama pulak😹,Terharu melihat btr juara mpl mana mdl nya sama pulak,terharu melihat btr juara mpl mana mdl nya sama pulak,"['terharu', 'melihat', 'btr', 'juara', 'mpl', 'mana', 'mdl', 'nya', 'sama', 'pulak']","['terharu', 'melihat', 'btr', 'juara', 'mpl', 'mana', 'mdl', 'nya', 'sama', 'pulak']",Non-Toxic
Wkwkwk coba liat pemain onic mereka kek gak ada sedih sedihnya jir pas kalah malah ada yg seneng ama ketawa,Wkwkwk coba liat pemain onic mereka kek gak ada sedih sedihnya jir pas kalah malah ada yg seneng ama ketawa,wkwkwk coba liat pemain onic mereka kek gak ada sedih sedihnya jir pas kalah malah ada yg seneng ama ketawa,"['wkwkwk', 'coba', 'liat', 'pemain', 'onic', 'mereka', 'kek', 'gak', 'ada', 'sedih', 'sedihnya', 'jir', 'pas', 'kalah', 'malah', 'ada', 'yg', 'seneng', 'ama', 'ketawa']","['wkwkwk', 'coba', 'liat', 'pemain', 'onic', 'mereka', 'kek', 'tidak', 'ada', 'sedih', 'sedihnya', 'jir', 'pas', 'kalah', 'malah', 'ada', 'yang', 'seneng', 'ama', 'ketawa']",Non-Toxic
"4:38:51 Menang, tapi ekspresinya keliatan sangat tertekan",Menang tapi ekspresinya keliatan sangat tertekan,menang tapi ekspresinya keliatan sangat tertekan,"['menang', 'tapi', 'ekspresinya', 'keliatan', 'sangat', 'tertekan']","['menang', 'tapi', 'ekspresinya', 'keliatan', 'sangat', 'tertekan']",Non-Toxic
4:38:30 kelra marah kenapa? Ada yang tau?,kelra marah kenapa Ada yang tau,kelra marah kenapa ada yang tau,"['kelra', 'marah', 'kenapa', 'ada', 'yang', 'tau']","['kelra', 'marah', 'kenapa', 'ada', 'yang', 'tau']",Non-Toxic
Onic ganti skylar malah jdi gini wkwkwkw,Onic ganti skylar malah jdi gini wkwkwkw,onic ganti skylar malah jdi gini wkwkwkw,"['onic', 'ganti', 'skylar', 'malah', 'jdi', 'gini', 'wkwkwkw']","['onic', 'ganti', 'skylar', 'malah', 'jdi', 'gini', 'wkwkwkw']",Non-Toxic
Ko Ed permanenkan NNAEL,Ko Ed permanenkan NNAEL,ko ed permanenkan nnael,"['ko', 'ed', 'permanenkan', 'nnael']","['ko', 'ed', 'permanenkan', 'nnael']",Non-Toxic
Yes onic akhirnya klh untuk mematahkan kesombongan sans🫤🫣,Yes onic akhirnya klh untuk mematahkan kesombongan sans,yes onic akhirnya klh untuk mematahkan kesombongan sans,"['yes', 'onic', 'akhirnya', 'klh', 'untuk', 'mematahkan', 'kesombongan', 'sans']","['yes', 'onic', 'akhirnya', 'klh', 'untuk', 'mematahkan', 'kesombongan', 'sans']",Non-Toxic
gg btrr 💜,gg btrr,gg btrr,"['gg', 'btrr']","['gg', 'btrr']",Non-Toxic
GG BTR.,GG BTR,gg btr,"['gg', 'btr']","['gg', 'btr']",Non-Toxic
mantap,mantap,mantap,['mantap'],['mantap'],Non-Toxic
GG HERTODDD,GG HERTODDD,gg hertoddd,"['gg', 'hertoddd']","['gg', 'hertoddd']",Non-Toxic
#BTRWINNNNNNNNNNNNNNNNNNNNN 🤖,,,[],[],Non-Toxic
akhirnya btr juara jg,akhirnya btr juara jg,akhirnya btr juara jg,"['akhirnya', 'btr', 'juara', 'jg']","['akhirnya', 'btr', 'juara', 'juga']",Non-Toxic
1:51:12 ini ba onic juga yg gk pake baju onic?,ini ba onic juga yg gk pake baju onic,ini ba onic juga yg gk pake baju onic,"['ini', 'ba', 'onic', 'juga', 'yg', 'gk', 'pake', 'baju', 'onic']","['ini', 'ba', 'onic', 'juga', 'yang', 'tidak', 'pake', 'baju', 'onic']",Non-Toxic
Ler Tolongin Ler 😂,Ler Tolongin Ler,ler tolongin ler,"['ler', 'tolongin', 'ler']","['ler', 'tolongin', 'ler']",Non-Toxic
"oi tod, kapan upload lg? liga tani onic udh pecah, biasanya lu ngeluh klo onic mulu yg menang",oi tod kapan upload lg liga tani onic udh pecah biasanya lu ngeluh klo onic mulu yg menang,oi tod kapan upload lg liga tani onic udh pecah biasanya lu ngeluh klo onic mulu yg menang,"['oi', 'tod', 'kapan', 'upload', 'lg', 'liga', 'tani', 'onic', 'udh', 'pecah', 'biasanya', 'lu', 'ngeluh', 'klo', 'onic', 'mulu', 'yg', 'menang']","['oi', 'tod', 'kapan', 'upload', 'lg', 'liga', 'tani', 'onic', 'sudah', 'pecah', 'biasanya', 'lu', 'ngeluh', 'klo', 'onic', 'mulu', 'yang', 'menang']",Non-Toxic
Itu shotgun jantungnya 140 terus wkwkwk,Itu shotgun jantungnya terus wkwkwk,itu shotgun jantungnya terus wkwkwk,"['itu', 'shotgun', 'jantungnya', 'terus', 'wkwkwk']","['itu', 'shotgun', 'jantungnya', 'terus', 'wkwkwk']",Non-Toxic
Onic melempem pas final,Onic melempem pas final,onic melempem pas final,"['onic', 'melempem', 'pas', 'final']","['onic', 'melempem', 'pas', 'final']",Non-Toxic
Mana nih yang bilng skylar digantj kelra bakal bantai bantai? Wkwk kacau ganti exp bukan gold terus wkwk,Mana nih yang bilng skylar digantj kelra bakal bantai bantai Wkwk kacau ganti exp bukan gold terus wkwk,mana nih yang bilng skylar digantj kelra bakal bantai bantai wkwk kacau ganti exp bukan gold terus wkwk,"['mana', 'nih', 'yang', 'bilng', 'skylar', 'digantj', 'kelra', 'bakal', 'bantai', 'bantai', 'wkwk', 'kacau', 'ganti', 'exp', 'bukan', 'gold', 'terus', 'wkwk']","['mana', 'nih', 'yang', 'bilng', 'skylar', 'digantj', 'kelra', 'bakal', 'bantai', 'bantai', 'wkwk', 'kacau', 'ganti', 'exp', 'bukan', 'gold', 'terus', 'wkwk']",Toxic
onic sengaja kalah karna sponsor hadiah hpnya murah. coba kalo brandnya masih samsung pasti gabakal kalah,onic sengaja kalah karna sponsor hadiah hpnya murah coba kalo brandnya masih samsung pasti gabakal kalah,onic sengaja kalah karna sponsor hadiah hpnya murah coba kalo brandnya masih samsung pasti gabakal kalah,"['onic', 'sengaja', 'kalah', 'karna', 'sponsor', 'hadiah', 'hpnya', 'murah', 'coba', 'kalo', 'brandnya', 'masih', 'samsung', 'pasti', 'gabakal', 'kalah']","['onic', 'sengaja', 'kalah', 'karna', 'sponsor', 'hadiah', 'hpnya', 'murah', 'coba', 'kalau', 'brandnya', 'masih', 'samsung', 'pasti', 'gabakal', 'kalah']",Non-Toxic
napa patah2 dah,napa patah dah,napa patah dah,"['napa', 'patah', 'dah']","['napa', 'patah', 'sudah']",Non-Toxic
Wau,Wau,wau,['wau'],['wau'],Non-Toxic
Btr program to win program to win ngik ngik ngik,Btr program to win program to win ngik ngik ngik,btr program to win program to win ngik ngik ngik,"['btr', 'program', 'to', 'win', 'program', 'to', 'win', 'ngik', 'ngik', 'ngik']","['btr', 'program', 'to', 'win', 'program', 'to', 'win', 'ngik', 'ngik', 'ngik']",Non-Toxic
WR Roby 💯,WR Roby,wr roby,"['wr', 'roby']","['wr', 'roby']",Non-Toxic
Ler tolongin ler,Ler tolongin ler,ler tolongin ler,"['ler', 'tolongin', 'ler']","['ler', 'tolongin', 'ler']",Non-Toxic
btr tidak menyia-nyiakan tiker dari rrq,btr tidak menyianyiakan tiker dari rrq,btr tidak menyianyiakan tiker dari rrq,"['btr', 'tidak', 'menyianyiakan', 'tiker', 'dari', 'rrq']","['btr', 'tidak', 'menyianyiakan', 'tiker', 'dari', 'rrq']",Non-Toxic
5:41:30 veteran perang,veteran perang,veteran perang,"['veteran', 'perang']","['veteran', 'perang']",Non-Toxic
Gara Gara Robi pancoro,Gara Gara Robi pancoro,gara gara robi pancoro,"['gara', 'gara', 'robi', 'pancoro']","['gara', 'gara', 'robi', 'pancoro']",Non-Toxic
"Jujur gua seneng,",Jujur gua seneng,jujur gua seneng,"['jujur', 'gua', 'seneng']","['jujur', 'gue', 'seneng']",Non-Toxic
Akhirnya punya cincin,Akhirnya punya cincin,akhirnya punya cincin,"['akhirnya', 'punya', 'cincin']","['akhirnya', 'punya', 'cincin']",Non-Toxic
KATANYA LIGA TANI WKWKWKKW,KATANYA LIGA TANI WKWKWKKW,katanya liga tani wkwkwkkw,"['katanya', 'liga', 'tani', 'wkwkwkkw']","['katanya', 'liga', 'tani', 'wkwkwkkw']",Non-Toxic
"Kok kyk ada yg janggal ya...hepy nya kaku bget...
Seperti sudah tau klw mereka bkal juara...",Kok kyk ada yg janggal yahepy nya kaku bget Seperti sudah tau klw mereka bkal juara,kok kyk ada yg janggal yahepy nya kaku bget seperti sudah tau klw mereka bkal juara,"['kok', 'kyk', 'ada', 'yg', 'janggal', 'yahepy', 'nya', 'kaku', 'bget', 'seperti', 'sudah', 'tau', 'klw', 'mereka', 'bkal', 'juara']","['kok', 'kyk', 'ada', 'yang', 'janggal', 'yahepy', 'nya', 'kaku', 'bget', 'seperti', 'sudah', 'tau', 'klw', 'mereka', 'bkal', 'juara']",Non-Toxic
keren,keren,keren,['keren'],['keren'],Non-Toxic
Yeb tolong yeb😂😂,Yeb tolong yeb,yeb tolong yeb,"['yeb', 'tolong', 'yeb']","['yeb', 'tolong', 'yeb']",Non-Toxic
"Min tadi pas aku mancing kan itu jelas jelas dapet ikan legenda yakan tapi hp ku ngeleg terus aku buka tutup aplikasi nya kan nah pas udah bener tiba tiba aku liat di list ikan legenda nya itu belum di masukin di list plis min kembaliin ikan legenda ku maaf kalo aku yang salah😢😢😢😢
Surat untuk Mimin moonton😢😢",Min tadi pas aku mancing kan itu jelas jelas dapet ikan legenda yakan tapi hp ku ngeleg terus aku buka tutup aplikasi nya kan nah pas udah bener tiba tiba aku liat di list ikan legenda nya itu belum di masukin di list plis min kembaliin ikan legenda ku maaf kalo aku yang salah Surat untuk Mimin moonton,min tadi pas aku mancing kan itu jelas jelas dapet ikan legenda yakan tapi hp ku ngeleg terus aku buka tutup aplikasi nya kan nah pas udah bener tiba tiba aku liat di list ikan legenda nya itu belum di masukin di list plis min kembaliin ikan legenda ku maaf kalo aku yang salah surat untuk mimin moonton,"['min', 'tadi', 'pas', 'aku', 'mancing', 'kan', 'itu', 'jelas', 'jelas', 'dapet', 'ikan', 'legenda', 'yakan', 'tapi', 'hp', 'ku', 'ngeleg', 'terus', 'aku', 'buka', 'tutup', 'aplikasi', 'nya', 'kan', 'nah', 'pas', 'udah', 'bener', 'tiba', 'tiba', 'aku', 'liat', 'di', 'list', 'ikan', 'legenda', 'nya', 'itu', 'belum', 'di', 'masukin', 'di', 'list', 'plis', 'min', 'kembaliin', 'ikan', 'legenda', 'ku', 'maaf', 'kalo', 'aku', 'yang', 'salah', 'surat', 'untuk', 'mimin', 'moonton']","['min', 'tadi', 'pas', 'aku', 'mancing', 'kan', 'itu', 'jelas', 'jelas', 'dapet', 'ikan', 'legenda', 'yakan', 'tapi', 'hp', 'ku', 'ngeleg', 'terus', 'aku', 'buka', 'tutup', 'aplikasi', 'nya', 'kan', 'nah', 'pas', 'udah', 'bener', 'tiba', 'tiba', 'aku', 'liat', 'di', 'list', 'ikan', 'legenda', 'nya', 'itu', 'belum', 'di', 'masukin', 'di', 'list', 'plis', 'min', 'kembaliin', 'ikan', 'legenda', 'ku', 'maaf', 'kalau', 'aku', 'yang', 'salah', 'surat', 'untuk', 'mimin', 'moonton']",Non-Toxic
Btr juara ikut bahagia,Btr juara ikut bahagia,btr juara ikut bahagia,"['btr', 'juara', 'ikut', 'bahagia']","['btr', 'juara', 'ikut', 'bahagia']",Non-Toxic
Yeb berharap d kasi cincin lagi 😂,Yeb berharap d kasi cincin lagi,yeb berharap d kasi cincin lagi,"['yeb', 'berharap', 'd', 'kasi', 'cincin', 'lagi']","['yeb', 'berharap', 'd', 'kasi', 'cincin', 'lagi']",Non-Toxic
"Makan tuh kelra, pas ad Skyler mh menang tuh... Wkwkwk malah dibuang",Makan tuh kelra pas ad Skyler mh menang tuh Wkwkwk malah dibuang,makan tuh kelra pas ad skyler mh menang tuh wkwkwk malah dibuang,"['makan', 'tuh', 'kelra', 'pas', 'ad', 'skyler', 'mh', 'menang', 'tuh', 'wkwkwk', 'malah', 'dibuang']","['makan', 'tuh', 'kelra', 'pas', 'ad', 'skyler', 'mh', 'menang', 'tuh', 'wkwkwk', 'malah', 'dibuang']",Non-Toxic
Kembali kan skyler,Kembali kan skyler,kembali kan skyler,"['kembali', 'kan', 'skyler']","['kembali', 'kan', 'skyler']",Non-Toxic
Apa maksud 5:34:42 harusnya double mvp?,Apa maksud harusnya double mvp,apa maksud harusnya double mvp,"['apa', 'maksud', 'harusnya', 'double', 'mvp']","['apa', 'maksud', 'harusnya', 'double', 'mvp']",Non-Toxic
Akhir nya eman😢,Akhir nya eman,akhir nya eman,"['akhir', 'nya', 'eman']","['akhir', 'nya', 'eman']",Non-Toxic
Arsenal = Bigetron,Arsenal Bigetron,arsenal bigetron,"['arsenal', 'bigetron']","['arsenal', 'bigetron']",Non-Toxic
Panas ye belum buka puasa timnya oh ya soalnya #9,Panas ye belum buka puasa timnya oh ya soalnya,panas ye belum buka puasa timnya oh ya soalnya,"['panas', 'ye', 'belum', 'buka', 'puasa', 'timnya', 'oh', 'ya', 'soalnya']","['panas', 'ye', 'belum', 'buka', 'puasa', 'timnya', 'oh', 'ya', 'soalnya']",Non-Toxic
Dia pengennya mau di MPL ataupun MSC di Paris dia 2 kali finals MVP,Dia pengennya mau di MPL ataupun MSC di Paris dia kali finals MVP,dia pengennya mau di mpl ataupun msc di paris dia kali finals mvp,"['dia', 'pengennya', 'mau', 'di', 'mpl', 'ataupun', 'msc', 'di', 'paris', 'dia', 'kali', 'finals', 'mvp']","['dia', 'pengennya', 'mau', 'di', 'mpl', 'ataupun', 'msc', 'di', 'paris', 'dia', 'kali', 'finals', 'mvp']",Non-Toxic
"Kali ini gue gak respect Ama mpl id, giliran tim lain final mvp gk dapat piala ubs gold pula sama hp lagi 

Kek pilih kasih cokkk",Kali ini gue gak respect Ama mpl id giliran tim lain final mvp gk dapat piala ubs gold pula sama hp lagi Kek pilih kasih cokkk,kali ini gue gak respect ama mpl id giliran tim lain final mvp gk dapat piala ubs gold pula sama hp lagi kek pilih kasih cokkk,"['kali', 'ini', 'gue', 'gak', 'respect', 'ama', 'mpl', 'id', 'giliran', 'tim', 'lain', 'final', 'mvp', 'gk', 'dapat', 'piala', 'ubs', 'gold', 'pula', 'sama', 'hp', 'lagi', 'kek', 'pilih', 'kasih', 'cokkk']","['kali', 'ini', 'gue', 'tidak', 'respect', 'ama', 'mpl', 'id', 'giliran', 'tim', 'lain', 'final', 'mvp', 'tidak', 'dapat', 'piala', 'ubs', 'gold', 'pula', 'sama', 'hp', 'lagi', 'kek', 'pilih', 'kasih', 'cokkk']",Non-Toxic
Bukan nya onic vs btr udah semalem,Bukan nya onic vs btr udah semalem,bukan nya onic vs btr udah semalem,"['bukan', 'nya', 'onic', 'vs', 'btr', 'udah', 'semalem']","['bukan', 'nya', 'onic', 'vs', 'btr', 'udah', 'semalem']",Non-Toxic
1:14:53 ngakak gw sm komuk kelra ad bang ler lgi😹,ngakak gw sm komuk kelra ad bang ler lgi,ngakak gw sm komuk kelra ad bang ler lgi,"['ngakak', 'gw', 'sm', 'komuk', 'kelra', 'ad', 'bang', 'ler', 'lgi']","['ngakak', 'gue', 'sama', 'komuk', 'kelra', 'ad', 'bang', 'ler', 'lgi']",Non-Toxic
haha streak liga tani berakhir,haha streak liga tani berakhir,haha streak liga tani berakhir,"['haha', 'streak', 'liga', 'tani', 'berakhir']","['haha', 'streak', 'liga', 'tani', 'berakhir']",Non-Toxic
"Oh, jadi ini standard baru goldlaner? spesialis juara dua",Oh jadi ini standard baru goldlaner spesialis juara dua,oh jadi ini standard baru goldlaner spesialis juara dua,"['oh', 'jadi', 'ini', 'standard', 'baru', 'goldlaner', 'spesialis', 'juara', 'dua']","['oh', 'jadi', 'ini', 'standard', 'baru', 'goldlaner', 'spesialis', 'juara', 'dua']",Non-Toxic
mantap tidak jadi season liga tani,mantap tidak jadi season liga tani,mantap tidak jadi season liga tani,"['mantap', 'tidak', 'jadi', 'season', 'liga', 'tani']","['mantap', 'tidak', 'jadi', 'season', 'liga', 'tani']",Non-Toxic
"Udah cobaan
Malah cobain",Udah cobaan Malah cobain,udah cobaan malah cobain,"['udah', 'cobaan', 'malah', 'cobain']","['udah', 'cobaan', 'malah', 'cobain']",Non-Toxic
"KENAPA BTR JUARA? KRNA ONIC BOSEN JUARA, BIKIN ORANG LAIN SENANG KAN DAPAT PAHALA",KENAPA BTR JUARA KRNA ONIC BOSEN JUARA BIKIN ORANG LAIN SENANG KAN DAPAT PAHALA,kenapa btr juara krna onic bosen juara bikin orang lain senang kan dapat pahala,"['kenapa', 'btr', 'juara', 'krna', 'onic', 'bosen', 'juara', 'bikin', 'orang', 'lain', 'senang', 'kan', 'dapat', 'pahala']","['kenapa', 'btr', 'juara', 'krna', 'onic', 'bosen', 'juara', 'bikin', 'orang', 'lain', 'senang', 'kan', 'dapat', 'pahala']",Non-Toxic
MPL ID udah bukan liga tani guysss,MPL ID udah bukan liga tani guysss,mpl id udah bukan liga tani guysss,"['mpl', 'id', 'udah', 'bukan', 'liga', 'tani', 'guysss']","['mpl', 'id', 'udah', 'bukan', 'liga', 'tani', 'guysss']",Non-Toxic
Pertama pin dong 😊😊🎉🎉,Pertama pin dong,pertama pin dong,"['pertama', 'pin', 'dong']","['pertama', 'pin', 'dong']",Non-Toxic
Terlalu ambisi & sombong meremehkan lawan mereka bilang liga tani akhirnya BTR juara malu kan lu ada juara baru thanks btR,Terlalu ambisi sombong meremehkan lawan mereka bilang liga tani akhirnya BTR juara malu kan lu ada juara baru thanks btR,terlalu ambisi sombong meremehkan lawan mereka bilang liga tani akhirnya btr juara malu kan lu ada juara baru thanks btr,"['terlalu', 'ambisi', 'sombong', 'meremehkan', 'lawan', 'mereka', 'bilang', 'liga', 'tani', 'akhirnya', 'btr', 'juara', 'malu', 'kan', 'lu', 'ada', 'juara', 'baru', 'thanks', 'btr']","['terlalu', 'ambisi', 'sombong', 'meremehkan', 'lawan', 'mereka', 'bilang', 'liga', 'tani', 'akhirnya', 'btr', 'juara', 'malu', 'kan', 'lu', 'ada', 'juara', 'baru', 'thanks', 'btr']",Toxic
"di counter nnael, produk onic sendiri😂",di counter nnael produk onic sendiri,di counter nnael produk onic sendiri,"['di', 'counter', 'nnael', 'produk', 'onic', 'sendiri']","['di', 'counter', 'nnael', 'produk', 'onic', 'sendiri']",Non-Toxic
GG BTR,GG BTR,gg btr,"['gg', 'btr']","['gg', 'btr']",Non-Toxic
GG HERTOD,GG HERTOD,gg hertod,"['gg', 'hertod']","['gg', 'hertod']",Non-Toxic
4:37:37 kelra kenapa woi??,kelra kenapa woi,kelra kenapa woi,"['kelra', 'kenapa', 'woi']","['kelra', 'kenapa', 'woi']",Non-Toxic
Hertod effect kah?? ni btr jadi kuat jirr,Hertod effect kah ni btr jadi kuat jirr,hertod effect kah ni btr jadi kuat jirr,"['hertod', 'effect', 'kah', 'ni', 'btr', 'jadi', 'kuat', 'jirr']","['hertod', 'effect', 'kah', 'ni', 'btr', 'jadi', 'kuat', 'jirr']",Non-Toxic
MPL tersepi jir viewsnya kagak sampe 3 juta semakin turun mulu viewsnya 😂,MPL tersepi jir viewsnya kagak sampe juta semakin turun mulu viewsnya,mpl tersepi jir viewsnya kagak sampe juta semakin turun mulu viewsnya,"['mpl', 'tersepi', 'jir', 'viewsnya', 'kagak', 'sampe', 'juta', 'semakin', 'turun', 'mulu', 'viewsnya']","['mpl', 'tersepi', 'jir', 'viewsnya', 'kagak', 'sampe', 'juta', 'semakin', 'turun', 'mulu', 'viewsnya']",Non-Toxic
ini waktunya BTR bukan onic,ini waktunya BTR bukan onic,ini waktunya btr bukan onic,"['ini', 'waktunya', 'btr', 'bukan', 'onic']","['ini', 'waktunya', 'btr', 'bukan', 'onic']",Non-Toxic
Kyy keluar btr malah berkembang 🫣🤣😁👍,Kyy keluar btr malah berkembang,kyy keluar btr malah berkembang,"['kyy', 'keluar', 'btr', 'malah', 'berkembang']","['kyy', 'keluar', 'btr', 'malah', 'berkembang']",Non-Toxic
Gg btr🎉🎉,Gg btr,gg btr,"['gg', 'btr']","['gg', 'btr']",Non-Toxic
"Koq kurang mriyah perayaan kemenangan nya,,",Koq kurang mriyah perayaan kemenangan nya,koq kurang mriyah perayaan kemenangan nya,"['koq', 'kurang', 'mriyah', 'perayaan', 'kemenangan', 'nya']","['koq', 'kurang', 'mriyah', 'perayaan', 'kemenangan', 'nya']",Non-Toxic
fakta skylar ngaruh di onic😂,fakta skylar ngaruh di onic,fakta skylar ngaruh di onic,"['fakta', 'skylar', 'ngaruh', 'di', 'onic']","['fakta', 'skylar', 'ngaruh', 'di', 'onic']",Non-Toxic
MPL SEKARANG GAK SERU!!! B AJA MAU SIAPAPUN YANG JUARA! BTW CONGRATULATIONS BTR! FLAT AJE ALUR NYE WKWKWK,MPL SEKARANG GAK SERU B AJA MAU SIAPAPUN YANG JUARA BTW CONGRATULATIONS BTR FLAT AJE ALUR NYE WKWKWK,mpl sekarang gak seru b aja mau siapapun yang juara btw congratulations btr flat aje alur nye wkwkwk,"['mpl', 'sekarang', 'gak', 'seru', 'b', 'aja', 'mau', 'siapapun', 'yang', 'juara', 'btw', 'congratulations', 'btr', 'flat', 'aje', 'alur', 'nye', 'wkwkwk']","['mpl', 'sekarang', 'tidak', 'seru', 'b', 'saja', 'mau', 'siapapun', 'yang', 'juara', 'btw', 'congratulations', 'btr', 'flat', 'aje', 'alur', 'nye', 'wkwkwk']",Non-Toxic
Gara gara rrq brooooo anjirrr btr lolos playofff juara lagi kelazzzzz,Gara gara rrq brooooo anjirrr btr lolos playofff juara lagi kelazzzzz,gara gara rrq brooooo anjirrr btr lolos playofff juara lagi kelazzzzz,"['gara', 'gara', 'rrq', 'brooooo', 'anjirrr', 'btr', 'lolos', 'playofff', 'juara', 'lagi', 'kelazzzzz']","['gara', 'gara', 'rrq', 'brooooo', 'anjirrr', 'btr', 'lolos', 'playofff', 'juara', 'lagi', 'kelazzzzz']",Non-Toxic
Nt raja langit,Nt raja langit,nt raja langit,"['nt', 'raja', 'langit']","['nt', 'raja', 'langit']",Non-Toxic
Kelass nnael,Kelass nnael,kelass nnael,"['kelass', 'nnael']","['kelass', 'nnael']",Non-Toxic
Ler tulong ler,Ler tulong ler,ler tulong ler,"['ler', 'tulong', 'ler']","['ler', 'tulong', 'ler']",Non-Toxic
"Debut player onic, Debut kairi juara, lutfi juara, savero juara, Skylar juara, kelra nt",Debut player onic Debut kairi juara lutfi juara savero juara Skylar juara kelra nt,debut player onic debut kairi juara lutfi juara savero juara skylar juara kelra nt,"['debut', 'player', 'onic', 'debut', 'kairi', 'juara', 'lutfi', 'juara', 'savero', 'juara', 'skylar', 'juara', 'kelra', 'nt']","['debut', 'player', 'onic', 'debut', 'kairi', 'juara', 'lutfi', 'juara', 'savero', 'juara', 'skylar', 'juara', 'kelra', 'nt']",Non-Toxic
Onic minusnya exp😂,Onic minusnya exp,onic minusnya exp,"['onic', 'minusnya', 'exp']","['onic', 'minusnya', 'exp']",Non-Toxic
BTR ga salah milih Analis Hertod,BTR ga salah milih Analis Hertod,btr ga salah milih analis hertod,"['btr', 'ga', 'salah', 'milih', 'analis', 'hertod']","['btr', 'tidak', 'salah', 'milih', 'analis', 'hertod']",Non-Toxic
respek btr,respek btr,respek btr,"['respek', 'btr']","['respek', 'btr']",Non-Toxic
Kelra gapernah bisa ngalahin Emann,Kelra gapernah bisa ngalahin Emann,kelra gapernah bisa ngalahin emann,"['kelra', 'gapernah', 'bisa', 'ngalahin', 'emann']","['kelra', 'gapernah', 'bisa', 'ngalahin', 'emann']",Non-Toxic
MENDING HERTOD AJA YANG JADI COACH TIMNAS DARIPADA KeJEniUsAN sEPeR,MENDING HERTOD AJA YANG JADI COACH TIMNAS DARIPADA KeJEniUsAN sEPeR,mending hertod aja yang jadi coach timnas daripada kejeniusan seper,"['mending', 'hertod', 'aja', 'yang', 'jadi', 'coach', 'timnas', 'daripada', 'kejeniusan', 'seper']","['mending', 'hertod', 'saja', 'yang', 'jadi', 'coach', 'timnas', 'daripada', 'kejeniusan', 'seper']",Non-Toxic
Njir di cipok nnael😂,Njir di cipok nnael,njir di cipok nnael,"['njir', 'di', 'cipok', 'nnael']","['njir', 'di', 'cipok', 'nnael']",Non-Toxic
numpang nyimpen part ini 3:59:14 wkwkw,numpang nyimpen part ini wkwkw,numpang nyimpen part ini wkwkw,"['numpang', 'nyimpen', 'part', 'ini', 'wkwkw']","['numpang', 'nyimpen', 'part', 'ini', 'wkwkw']",Non-Toxic
Real jimat roby,Real jimat roby,real jimat roby,"['real', 'jimat', 'roby']","['real', 'jimat', 'roby']",Non-Toxic
"Mngkanya Skylar jangan di rehatin, jadi kalah kann onic",Mngkanya Skylar jangan di rehatin jadi kalah kann onic,mngkanya skylar jangan di rehatin jadi kalah kann onic,"['mngkanya', 'skylar', 'jangan', 'di', 'rehatin', 'jadi', 'kalah', 'kann', 'onic']","['mngkanya', 'skylar', 'jangan', 'di', 'rehatin', 'jadi', 'kalah', 'kann', 'onic']",Non-Toxic
moreno eman good hahaha Sonic mana,moreno eman good hahaha Sonic mana,moreno eman good hahaha sonic mana,"['moreno', 'eman', 'good', 'hahaha', 'sonic', 'mana']","['moreno', 'eman', 'good', 'hahaha', 'sonic', 'mana']",Non-Toxic
5:07:44 ❤,,,[],[],Non-Toxic
"2:06:19
Terpantau Mac Book di room BTR #Infinix",Terpantau Mac Book di room BTR,terpantau mac book di room btr,"['terpantau', 'mac', 'book', 'di', 'room', 'btr']","['terpantau', 'mac', 'book', 'di', 'room', 'btr']",Non-Toxic
"Sorry ya MPL MY, MPL ID masih bisa naikin tim baru buat menang wkwkwk",Sorry ya MPL MY MPL ID masih bisa naikin tim baru buat menang wkwkwk,sorry ya mpl my mpl id masih bisa naikin tim baru buat menang wkwkwk,"['sorry', 'ya', 'mpl', 'my', 'mpl', 'id', 'masih', 'bisa', 'naikin', 'tim', 'baru', 'buat', 'menang', 'wkwkwk']","['sorry', 'ya', 'mpl', 'my', 'mpl', 'id', 'masih', 'bisa', 'naikin', 'tim', 'baru', 'buat', 'menang', 'wkwkwk']",Non-Toxic
"Udh lah respect aja njir, DUKUNG BTR AND ONIC DI EWC",Udh lah respect aja njir DUKUNG BTR AND ONIC DI EWC,udh lah respect aja njir dukung btr and onic di ewc,"['udh', 'lah', 'respect', 'aja', 'njir', 'dukung', 'btr', 'and', 'onic', 'di', 'ewc']","['sudah', 'lah', 'respect', 'saja', 'njir', 'dukung', 'btr', 'and', 'onic', 'di', 'ewc']",Non-Toxic
Giliran skylar kalah banyak yg ga respek 😂,Giliran skylar kalah banyak yg ga respek,giliran skylar kalah banyak yg ga respek,"['giliran', 'skylar', 'kalah', 'banyak', 'yg', 'ga', 'respek']","['giliran', 'skylar', 'kalah', 'banyak', 'yang', 'tidak', 'respek']",Non-Toxic
Skylarr is bakk kah😂😂,Skylarr is bakk kah,skylarr is bakk kah,"['skylarr', 'is', 'bakk', 'kah']","['skylarr', 'is', 'bakk', 'kah']",Non-Toxic
congrats btr by sonic,congrats btr by sonic,congrats btr by sonic,"['congrats', 'btr', 'by', 'sonic']","['congrats', 'btr', 'by', 'sonic']",Non-Toxic
Apa kabar kairi😂😂😂,Apa kabar kairi,apa kabar kairi,"['apa', 'kabar', 'kairi']","['apa', 'kabar', 'kairi']",Non-Toxic
wwkwkwk pertama kali main di mpl id langsung kalah 😂😂😂😂😂😂😂,wwkwkwk pertama kali main di mpl id langsung kalah,wwkwkwk pertama kali main di mpl id langsung kalah,"['wwkwkwk', 'pertama', 'kali', 'main', 'di', 'mpl', 'id', 'langsung', 'kalah']","['wwkwkwk', 'pertama', 'kali', 'main', 'di', 'mpl', 'id', 'langsung', 'kalah']",Non-Toxic
